{
  "schema": "marketplace.event.v1",
  "event_type": "ENTITLEMENT_CREATED",
  "vendor": "gcp",
  "event_id": "fixture-gcp-entitlement-created-001",
  "occurred_at": "2026-06-05T00:00:00Z",
  "received_at": "2026-06-05T00:00:01Z",
  "offer": {
    "vendor_offer_id": "TODO_GCP_PRODUCT_ID",
    "vendor_plan_id": "TODO_GCP_TEAM_PLAN_ID",
    "vendor_private_offer_id": null,
    "vendor_subscription_id": null,
    "vendor_entitlement_id": "TODO_GCP_ENTITLEMENT_ID",
    "vendor_account_id": "TODO_GCP_ACCOUNT_ID",
    "vendor_tenant_id": null
  },
  "canonical": {
    "plan_id": "team",
    "addons": ["addon.integrations"],
    "tenant_id": null
  },
  "lifecycle": {
    "status": "purchase_requested",
    "effective_at": "2026-06-05T00:00:00Z",
    "grace_until": null
  },
  "security": {
    "signature_verified": true,
    "replay_protected": true,
    "source_ip_validated": null,
    "auth_context": "fixture"
  },
  "idempotency": {
    "dedupe_key": "gcp:fixture-gcp-entitlement-created-001",
    "sequence": null
  }
}
