{
  "schema": "marketplace.event.v1",
  "event_type": "SUBSCRIPTION_CREATED",
  "vendor": "azure",
  "event_id": "fixture-azure-subscription-created-001",
  "occurred_at": "2026-06-05T00:00:00Z",
  "received_at": "2026-06-05T00:00:01Z",
  "offer": {
    "vendor_offer_id": "TODO_AZURE_OFFER_ID",
    "vendor_plan_id": "TODO_AZURE_TEAM_PLAN_ID",
    "vendor_private_offer_id": null,
    "vendor_subscription_id": "TODO_AZURE_SUBSCRIPTION_ID",
    "vendor_entitlement_id": null,
    "vendor_account_id": null,
    "vendor_tenant_id": "TODO_ENTRA_TENANT_ID"
  },
  "canonical": {
    "plan_id": "team",
    "addons": ["addon.integrations"],
    "tenant_id": null
  },
  "lifecycle": {
    "status": "provisioning_pending",
    "effective_at": "2026-06-05T00:00:00Z",
    "grace_until": null
  },
  "security": {
    "signature_verified": true,
    "replay_protected": true,
    "source_ip_validated": null,
    "auth_context": "fixture"
  },
  "idempotency": {
    "dedupe_key": "azure:TODO_AZURE_SUBSCRIPTION_ID:SUBSCRIPTION_CREATED:2026-06-05T00:00:00Z",
    "sequence": null
  }
}
